[
  {
    "id": "granola",
    "display_name": "Granola",
    "description": "Meeting transcription + summarization; transcripts pulled into vault for downstream processing.",
    "mcp_server_id": "claude_ai_Granola",
    "category": "transcription",
    "role_recommendations": ["consultant", "researcher"],
    "default_pipeline_template_id": "granola-meetings",
    "default_schedule": "0 6 * * *",
    "default_target_vault_path": "Inbox/Meetings/",
    "default_processor_skill": "meeting-processor",
    "failure_mode_catalog_ref": "block-and-log"
  },
  {
    "id": "gcal",
    "display_name": "Google Calendar",
    "description": "Calendar events synced into vault inbox for daily briefing + agenda awareness.",
    "mcp_server_id": "claude_ai_Google_Calendar",
    "category": "calendar",
    "role_recommendations": ["consultant", "solo-founder", "engineer", "operator"],
    "default_pipeline_template_id": null,
    "default_schedule": "*/15 * * * *",
    "default_target_vault_path": "Inbox/",
    "default_processor_skill": null,
    "failure_mode_catalog_ref": "skip-and-log"
  },
  {
    "id": "gmail",
    "display_name": "Gmail",
    "description": "Email digest pulled daily; classifier surfaces action items + responses-needed into vault inbox.",
    "mcp_server_id": "claude_ai_Gmail",
    "category": "email",
    "role_recommendations": ["consultant", "solo-founder", "operator"],
    "default_pipeline_template_id": null,
    "default_schedule": "0 7 * * *",
    "default_target_vault_path": "Inbox/Email/",
    "default_processor_skill": null,
    "failure_mode_catalog_ref": "block-and-log"
  },
  {
    "id": "gdrive",
    "display_name": "Google Drive",
    "description": "Recent-files + shared-with-me discovery; metadata indexed into vault for ad-hoc lookup.",
    "mcp_server_id": "claude_ai_Google_Drive",
    "category": "storage",
    "role_recommendations": ["consultant", "researcher"],
    "default_pipeline_template_id": null,
    "default_schedule": "manual",
    "default_target_vault_path": null,
    "default_processor_skill": null,
    "failure_mode_catalog_ref": "skip-and-log"
  },
  {
    "id": "atlassian",
    "display_name": "Atlassian (Jira + Confluence)",
    "description": "Issue tracker + wiki access; queryable per project for context retrieval.",
    "mcp_server_id": "claude_ai_Atlassian",
    "category": "tasks",
    "role_recommendations": ["researcher", "engineer"],
    "default_pipeline_template_id": null,
    "default_schedule": "manual",
    "default_target_vault_path": null,
    "default_processor_skill": null,
    "failure_mode_catalog_ref": "skip-and-log"
  },
  {
    "id": "slack",
    "display_name": "Slack",
    "description": "Channel + DM scraping into vault chat-digest for daily review + action-item extraction.",
    "mcp_server_id": null,
    "category": "messaging",
    "role_recommendations": ["consultant", "engineer", "operator"],
    "default_pipeline_template_id": null,
    "default_schedule": "*/30 * * * *",
    "default_target_vault_path": "Inbox/",
    "default_processor_skill": null,
    "failure_mode_catalog_ref": "backoff-retry"
  },
  {
    "id": "teams",
    "display_name": "Microsoft Teams",
    "description": "Channel + chat scraping (Chrome MCP DOM-based); written into vault chat-digest.",
    "mcp_server_id": null,
    "category": "messaging",
    "role_recommendations": ["consultant", "operator"],
    "default_pipeline_template_id": null,
    "default_schedule": "*/30 * * * *",
    "default_target_vault_path": "Inbox/",
    "default_processor_skill": null,
    "failure_mode_catalog_ref": "backoff-retry"
  },
  {
    "id": "notion",
    "display_name": "Notion",
    "description": "Page + database access; queryable via MCP for cross-workspace lookup.",
    "mcp_server_id": null,
    "category": "notes",
    "role_recommendations": ["solo-founder", "researcher"],
    "default_pipeline_template_id": null,
    "default_schedule": "manual",
    "default_target_vault_path": null,
    "default_processor_skill": null,
    "failure_mode_catalog_ref": "skip-and-log"
  },
  {
    "id": "github",
    "display_name": "GitHub",
    "description": "Repo + PR + issue access via gh CLI integration; daily digest of activity into vault inbox.",
    "mcp_server_id": null,
    "category": "dev",
    "role_recommendations": ["solo-founder", "engineer"],
    "default_pipeline_template_id": null,
    "default_schedule": "0 8 * * *",
    "default_target_vault_path": "Inbox/",
    "default_processor_skill": null,
    "failure_mode_catalog_ref": "skip-and-log"
  },
  {
    "id": "linear",
    "display_name": "Linear",
    "description": "Issue tracker; assigned-to-me + recent-activity digest into vault inbox.",
    "mcp_server_id": null,
    "category": "tasks",
    "role_recommendations": ["solo-founder", "engineer"],
    "default_pipeline_template_id": null,
    "default_schedule": "0 8 * * *",
    "default_target_vault_path": "Inbox/",
    "default_processor_skill": null,
    "failure_mode_catalog_ref": "skip-and-log"
  },
  {
    "id": "asana",
    "display_name": "Asana",
    "description": "Task assignments + project status; daily digest of my-tasks into vault inbox.",
    "mcp_server_id": null,
    "category": "tasks",
    "role_recommendations": ["consultant", "operator"],
    "default_pipeline_template_id": null,
    "default_schedule": "0 8 * * *",
    "default_target_vault_path": "Inbox/",
    "default_processor_skill": null,
    "failure_mode_catalog_ref": "skip-and-log"
  },
  {
    "id": "figma",
    "display_name": "Figma",
    "description": "Design file access; queryable via MCP for cross-project lookup. Manual-only by default.",
    "mcp_server_id": null,
    "category": "design",
    "role_recommendations": [],
    "default_pipeline_template_id": null,
    "default_schedule": "manual",
    "default_target_vault_path": null,
    "default_processor_skill": null,
    "failure_mode_catalog_ref": "skip-and-log"
  }
]
